ID,Name,Latitude,Longitude,Water Temperature,Skill Level,Depth Range,Description,Visibility,Best Time,Region,Marine Life,Hazards,Facilities,Image URL,Featured,Created At,Viz Slug,Compass Bearing,Nearby Runoff,Viz Triggers,Viz Seasonal,Duplicate Flag
2,SS Yongala Wreck,-19.31670000,147.61670000,"22-28°C",Advanced,"14-30m","One of the worlds best wreck dives, the SS Yongala sank in 1911 and is now an artificial reef teeming with marine life. The 109-meter vessel attracts massive schools of fish and pelagic species.","10-25m","April-November","Great Barrier Reef - Townsville","Bull sharks, eagle rays, sea snakes, giant grouper, trevally, barracuda","Strong currents, penetration hazards, marine life encounters","Day boat access, advanced certification required",https://greatbarrierreeftours.com/files/2023/10/ss-yongala.png",false,2025-06-07T04:16:54.315Z,,,,,,NO
3,Julian Rocks,-28.62970000,153.63970000,"18-24°C",Beginner,"5-25m","A volcanic rock formation 2.5km offshore from Byron Bay, offering diverse marine life and excellent underwater photography opportunities. Protected marine park with year-round diving.","10-30m","Year-round","Byron Bay, NSW","Grey nurse sharks, leopard sharks, turtles, rays, tropical fish","Seasonal strong currents, boat traffic","Multiple dive operators, shore dive possible",https://snorkelingbyronbay.com.au/wp-content/uploads/2021/10/Moray-Eel.jpg",false,2025-06-07T04:16:54.315Z,,,,,,POSSIBLE: Julian Rocks – Cod Hole (166), Julian Rocks – Hugo's Trench (197), Julian Rocks – The Nursery (165), Julian Rocks Marine Sanctuary (240)
166,Julian Rocks – Cod Hole,-28.64400000,153.62750000,"20–26 °C",Intermediate,"10–22 m","Swim-through with large cod and pelagics.","10–15 m","October–April","Byron Bay, NSW","Cod, snapper, eagle rays","Current","Boat dive",https://images.unsplash.com/photo-1583212292454-1fe6229603b7?ixlib=rb-4.0.3&auto=format&fit=crop&w=800&h=600",false,2025-06-07T12:03:38.556Z,,,,,,POSSIBLE: Julian Rocks (3), Julian Rocks – Hugo's Trench (197), Julian Rocks – The Nursery (165), Julian Rocks Marine Sanctuary (240)
165,Julian Rocks – The Nursery,-28.64310000,153.62720000,"20–26 °C",Beginner,"5–12 m","Sheltered site with turtles, rays and wobbegongs.","10–15 m","October–April","Byron Bay, NSW","Turtles, wobbegong sharks, rays","Boat traffic","Boat dive, marine park rules",https://images.unsplash.com/photo-1583212292454-1fe6229603b7?ixlib=rb-4.0.3&auto=format&fit=crop&w=800&h=600",false,2025-06-07T12:03:38.556Z,,,,,,POSSIBLE: Julian Rocks (3), Julian Rocks – Cod Hole (166), Julian Rocks – Hugo's Trench (197), Julian Rocks Marine Sanctuary (240)
197,Julian Rocks – Hugo's Trench,-28.64490000,153.62670000,"20–26 °C",Intermediate,"10–22 m","Narrow trench with reef sharks and strong visibility.","10–18 m","Spring–Summer","Byron Bay, NSW","Sharks, rays, groupers","Current","Boat dive",https://images.unsplash.com/photo-1583212292454-1fe6229603b7?ixlib=rb-4.0.3&auto=format&fit=crop&w=800&h=600",false,2025-06-07T12:04:56.688Z,,,,,,POSSIBLE: Julian Rocks (3), Julian Rocks – Cod Hole (166), Julian Rocks – The Nursery (165), Julian Rocks Marine Sanctuary (240)
240,Julian Rocks Marine Sanctuary,-28.63330000,153.61670000,"20–24 °C",All Levels,"5–35 m","A world-class dive site within the Cape Byron Marine Park, home to over 1,000 marine species.","10–30 m","Year-round","Byron Bay, NSW","Manta rays, leopard sharks, grey nurse sharks, turtles, reef fish","Strong currents","Boat access",https://images.unsplash.com/photo-1583212292454-1fe6229603b7?ixlib=rb-4.0.3&auto=format&fit=crop&w=800&h=600",false,2025-06-07T21:54:08.727Z,,,,,,POSSIBLE: Julian Rocks (3), Julian Rocks – Cod Hole (166), Julian Rocks – Hugo's Trench (197), Julian Rocks – The Nursery (165)
24,North Bondi Rocks,-33.88980000,151.28150000,"17–23°C",Beginner,"2–12m","Sheltered site with rocky outcrops and marine life near the rock pool.","5–10m","October–April","Bondi, NSW","Leatherjackets, octopus, rays","Swell, swimmers","Shore access, beach amenities",https://d2p1cf6997m1ir.cloudfront.net/media/thumbnails/58/4d/584d055615ceb3dcf09bd006a0ee3352.webp",false,2025-06-07T07:54:34.592Z,north-bondi-rocks,90,"Bondi Beach stormwater drain approximately 600m north; large urban catchment from Bondi, Bellevue Hill and surrounds","Northerly swells churn sand; strong easterly swell drops viz to under 3m; rain events reduce viz by 50-60% for 2-3 days","Summer: 8-12m; Autumn best (10-15m); Winter: 6-10m; Spring: 5-8m (plankton blooms)",POSSIBLE: North Bondi Bommie (67), Bondi Reef (see descriptions)
67,North Bondi Bommie,-33.88850000,151.28300000,"17–23 °C",Intermediate,"6–18 m","Rocky bommie with good fish life and occasional pelagics.","10–15 m","October–April","Bondi, NSW","Groper, trevally, rays","Boat traffic, surge","Shore/boat access",https://images.unsplash.com/photo-1582967788606-a171c1080cb0?ixlib=rb-4.0.3&auto=format&fit=crop&w=800&h=600",false,2025-06-07T11:31:18.967Z,north-bondi-bommie,90,"Same Bondi Beach stormwater as North Bondi Rocks - large urban catchment from Bondi and surrounds","Same as North Bondi Rocks - northerly swells and rain events reduce viz; bommie surge from any easterly swell","Same as North Bondi Rocks: Summer 8-12m, Autumn best (10-15m), Winter 6-10m, Spring 5-8m",POSSIBLE: North Bondi Rocks (24)
...